Name,wc_id,primary_cuisine,primary_coarse,Cuisines,Countries,Region1,Text Description
Honey bun,honey_bun,American,bread,"[""American""]","[""United States""]",Northern America,The dish is a fried yeast pastry that contains honey and a swirl of cinnamon in the dough and is glazed with icing.
Christmas ham,christmas_ham,Northern European,meat,"[""Northern European""]","[""Sweden"", ""Finland"", ""United States"", ""Australia"", ""Philippines""]",South Eastern Asia,The dish is a ham often served for special occassion dinner.
Croque monsieur,croque_monsieur,French,bread,"[""French""]","[""France""]",Western Europe,"The dish is traditionally made with baked or boiled ham and sliced cheese between slices of bread, topped with grated cheese and lightly salted and peppered, and then baked in an oven or fried in a frying pan. The bread may optionally be browned by grilling after being dipped in beaten egg."
Denver sandwich,denver_sandwich,American,bread,"[""American""]","[""United States""]",Northern America,"The dish consists of an omelette (consisting of at least ham, onion, green pepper, and scrambled eggs), sandwiched between two pieces of bread."
Francesinha,francesinha,Portuguese,bread,"[""Portuguese""]","[""Portugal""]",Southern Europe,"The dish is a sandwich made with layers of toasted bread and assorted hot meats such as roast, steak, wet-cured ham over which sliced cheese is melted by the ladling of a near-boiling tomato-and-beer sauce. It is typically served with french fries."
Ham and cheese sandwich,ham_and_cheese_sandwich,British,bread,"[""British""]","[""United Kingdom""]",Northern Europe,"The dish is a common type of sandwich. The bread may be fresh or toasted, filled with ham and chesse, and it can be made with a variety of toppings including cheese and Vegetable like lettuce, tomato, onion or pickle slices. Various kinds of mustard and mayonnaise are also common."
Ham and eggs,ham_and_eggs,American,egg,"[""American""]","[""United States""]",Northern America,The dish is a dish combining various preparations of ham and egg.
Ham salad,ham_salad,American,salad,"[""American"", ""British""]","[""United States"", ""United Kingdom"", ""Canada"", ""Australia""]",Australia and New Zealand,"The dish primary ingredient, ham, is mixed with smaller amounts of chopped Vegetable or relishes, and the whole is bound with liberal amounts of a mayonnaise, salad cream, or other similar style of salad dressing."
Ham sandwich,ham_sandwich,British,bread,"[""British""]","[""United Kingdom""]",Northern Europe,"The dish is a common type of sandwich. The bread may be fresh or toasted, filled with ham, and it can be made with a variety of toppings including cheese and vegetable like lettuce, tomato, onion or pickle slices. Various kinds of mustard and mayonnaise are also common."
Hawaiian pizza,hawaiian_pizza,Canadian,pizza,"[""Canadian""]","[""Canada""]",Northern America,"The dish is a pizza traditionally topped with pineapple, tomato sauce, mozzarella cheese, and either ham or bacon."
Jambon-beurre,jambonbeurre,French,bread,"[""French""]","[""France""]",Western Europe,"The dish is a ham sandwich made of a fresh baguette sliced open, spread with butter (salted or unsalted) and filled with slices of ham."
Chee Cheong Fun,chee_cheong_fun,Hong Kong,dim sum,"[""Hong Kong"", ""Chinese""]","[""China""]",Eastern Asia,"The dish is a thin roll made from a wide strip of shahe rice noodles, filled with shrimp, beef, Vegetable, or other ingredients. Seasoned soy sauce – sometimes with sauce drippings – is poured over the dish upon serving."
Plecing Kangkung,plecing_kangkung,Indonesian,vegetable,"[""Indonesian""]","[""Indonesia""]",South Eastern Asia,"The dish is made from blanched water spinach leaves and served cold with sambal made from ground red chili pepper, shallot, garlic, bird's eye chili, candlenut, kaffir lime, shrimp paste, salt, and sugar."
Cap cay,cap_cay,Chinese,stir fry,"[""Chinese""]","[""China"", ""Indonesia""]",South Eastern Asia,"The dish consists of various Vegetable such as cauliflower, cabbage, Chinese cabbage, Napa cabbage, carrot, baby corn, mushrooms, and leeks are chopped and stir-fried in a wok with small amount of cooking oil and water. Chopped garlic and onion with salt, sugar, soy sauce, cooking wine and oyster sauce are added for flavour. The liquid sauces are thickened using corn starch."
Sayur lodeh,sayur_lodeh,Indonesian,vegetable,"[""Indonesian""]","[""Indonesia""]",South Eastern Asia,"The dish is a vegetable soup prepared from Vegetable cooked in coconut milk. Common ingredients are young unripe jackfruit, eggplant, chayote, melinjo beans and leaves, long beans, green chili pepper, tofu and tempeh, cooked in coconut milk and sometimes enriched with chicken or beef stock."
Sayur asem,sayur_asem,Indonesian,vegetable,"[""Indonesian""]","[""Indonesia""]",South Eastern Asia,"The dish consists of Vegetable in tamarind soup. The sweet and sour flavour of this dish is considered refreshing and very compatible with fried or grilled dishes, including fried fish, fried chicken, and is usually eaten with steamed rice and sambal terasi chili paste."
Efo riro,efo_riro,Nigerian,vegetable,"[""Nigerian""]","[""Nigeria""]",Western Africa,"The dish is a vegetable soup. It was traditionally prepared with the locally grown Vegetable, meat, fish, and a mixture of spices. The choice of Vegetable and proteins varies based on personal preference and regional availability. The most commonly used Vegetable are spinach, pumpkin leaves, or sorrel leaves, often combined with bell peppers, chili peppers, and onions."
Ugali,ugali,Kenyan,corn,"[""Kenyan"",""Tanzanian""]","[""Kenya"",""Tanzania"", ""Uganda"", ""Tanzania"", ""Zimbabwe"", ""Zambia"", ""Lesotho"", ""Eswatini"", ""Angola"", ""Mozambique"", ""Namibia"", ""Democratic Republic of the Congo"", ""Malawi"", ""Botswana"", ""South Africa""]",Middle Africa,The dish is a type of corn meal made from maize or corn flour. It is cooked in boiling water or milk until it reaches a stiff or firm dough-like consistency.
Bobotie,bobotie,South African,meat,"[""South African""]","[""South Africa""]",Southern Africa,The dish consists of spiced minced meat baked with an egg-based topping.
Potjiekos,potjiekos,South African,meat,"[""South African""]","[""South Africa""]",Southern Africa,"The dish is made by first adding cooking oil to a potjie, and placed on a fire until hot. Meat is added, typically lamb or pork. The meat is spiced and often a form of alcohol is added for flavor - mostly beer or a dessert wine."
Vetkoek,vetkoek,South African,bread,"[""South African""]","[""South Africa""]",Southern Africa,"The dish is a fried dough similar in shape to a doughnut without a hole, and is made with a yeast dough. The dish is also often made alongside a curry mince, which is stuffed inside."
Bunny chow,bunny_chow,South African,bread,"[""South African""]","[""South Africa""]",Southern Africa,The dish consisting of a hollowed-out loaf of white bread filled with curry and a serving of salad on the side.
Pirozhki,pirozhki,Russian,bread,"[""Russian""]","[""Russia"", ""Armenia"", ""Azerbaijan"", ""Belarus"", ""Estonia"", ""Finland"", ""Iran"", ""Kazakhstan"", ""Kyrgyzstan"", ""Latvia"", ""Macedonia"", ""Mongolia"", ""Greece"", ""Serbia"", ""Tajikistan"", ""Turkmenistan"", ""Ukraine"", ""Uzbekistan""]",Global,"The dish is a baked or fried yeast-leavened boat-shaped buns with a variety of fillings. They come in sweet or savory varieties. Common savory fillings include ground meat, mashed potato, mushrooms, boiled egg with scallions, or cabbage. Typical sweet fillings are fruit (apple, cherry, apricot, lemon), jam, or tvorog"
Matapa,matapa,Mozambican,vegetable,"[""Mozambican""]","[""Mozambique""]",Eastern Africa,"The dish is prepared with young cassava leaves, which are usually ground in a large wooden mortar and pestle before being cooked with garlic, onion and coconut milk."
Konro,konro,Indonesian,soup,"[""Indonesian""]","[""Indonesia""]",South Eastern Asia,"This soup is made with ribs, such as spareribs or beef as main ingredient. The soup is brown-black in color and eaten either with rice cake cut into bite-size pieces or rice. The spicy and strong-tasting soup is made from a mixture of rich spices, which includes coriander, a fruit that gives it its blackish color, also small amount of nutmeg, turmeric, galangal, cinnamon, tamarind, lemongrass, clove, and  bayleaf."
Pan de jamón,pan_de_jamn,Venezuelan,bread,"[""Venezuelan""]","[""Venezuela""]",South America,"The dish is a bread, filled with ham, raisins and green olives. Many variations have been created, some filling the bread with other ingredients like turkey or cream cheese and others using puff pastry as the dough."
Schnitz un knepp,schnitz_un_knepp,American,meat,"[""American""]","[""United States""]",Northern America,The dish consists of ham or pork shoulder with dried apples and dumplings.
Toast Hawaii,toast_hawaii,German,bread,"[""German""]","[""Germany""]",Western Europe,"The dish is an open sandwich consisting of a slice of toast with ham and cheese, and a maraschino cherry in the middle of a pineapple slice, baked so that the cheese starts to melt."
Senate bean soup,senate_bean_soup,American,soup,"[""American""]","[""United States""]",Northern America,"The dish is a soup made with navy beans, ham hocks, and onion."
Schweinshaxe,schweinshaxe,German,meat,"[""German""]","[""Germany"", ""Austria""]",Western Europe,"The dish is a roasted ham hock (or pork knuckle). The ham hock is the end of the pig's leg, just above the ankle and below the meaty ham portion."
Pata tim,pata_tim,Filipino,meat,"[""Filipino""]","[""Philippines""]",South Eastern Asia,"The dish is a braised pork hock dish slow-cooked until very tender in soy sauce, black peppercorns, garlic, bay leaves, and star anise sweetened with sugar."
Paksiw na baboy,paksiw_na_baboy,Filipino,meat,"[""Filipino""]","[""Philippines""]",South Eastern Asia,"The dish consists of pork, usually hock or shank, cooked in ingredients similar to those in adobo but with the addition of sugar and banana blossoms (or pineapples) to make it sweeter and water to keep the meat moist and to yield a rich sauce."
Eisbein,eisbein,German,meat,"[""German""]","[""Germany""]",Western Europe,"The dish consists of corned ham hock, usually cured and slightly boiled."
Crispy pata,crispy_pata,Filipino,meat,"[""Filipino""]","[""Philippines""]",South Eastern Asia,The dish consists of deep fried pig trotters or knuckles served with a soy-vinegar dip.
Akashiyaki,akashiyaki,Japanese,dumpling,"[""Japanese""]","[""Japan""]",Eastern Asia,The dish is a small round dumpling. The dumpling is made of an egg-rich batter and octopus dipped into a thin fish broth before eating.
Akok,akok,Malaysian,dessert,"[""Malaysian""]","[""Malaysia""]",South Eastern Asia,"The dish can be consumed as a snack or as a dessert. It is made with flour, sugar, eggs, and coconut milk. The dish has two main variants. The former consists of the ingredients aforementioned. While the latter incorporates brown sugar or palm sugar into the batter mixture, which gives it a darker colouration."
Aletria,aletria,Portuguese,dessert,"[""Portuguese""]","[""Portugal""]",Southern Europe,The dish is a custardy dessert based on thin like pasta.
Ant egg soup,ant_egg_soup,Lao,soup,"[""Lao"", ""Thai""]","[""Laos"", ""Thailand"", ""Cambodia""]",South Eastern Asia,"The dish is a soup made from the eggs of the weaver ant species. Recipes for the dish may include ingredients such as chicken stock, lemongrass, fish sauce, chilies, tamarind, shallot and spring onion."
Avgolemono,avgolemono,Greek,soup,"[""Greek""]","[""Greece""]",Southern Europe,"The dish is a family of sauces and soups made with egg yolk and lemon juice mixed with broth, heated until they thicken. As a soup, this dish usually starts with chicken broth, though meat (usually lamb), fish, or vegetable broths are also used."
Baghali ghatogh,baghali_ghatogh,Iranian,stew,"[""Iranian""]","[""Iran""]",Southern Asia,"The dish is a stew made with fava beans, dill, and eggs. It's usually served with  rice dish. It is spiced with turmeric, salt, garlic, and sometimes pepper."
Balut,balut,Filipino,egg,"[""Filipino""]","[""Philippines"", ""Vietnam"", ""Cambodia""]",South Eastern Asia,The dish is a fertilized developing egg embryo that is boiled or steamed and eaten from the shell.
Fried egg,fried_egg,Global,egg,"[""Global""]","[""Global""]",Global,It is a cooked dish made from one or more eggs which are removed from their shells and placed into a frying pan and fried.
Carbonara,carbonara,Italian,pasta,"[""Italian""]","[""Italy""]",Southern Europe,"The dish is a pasta dish made with fatty cured pork, hard cheese, eggs, salt, and black pepper."
Century egg,century_egg,Chinese,egg,"[""Chinese""]","[""China""]",Eastern Asia,"The dish is an egg-based culinary dish made by preserving duck, chicken, or quail eggs in a mixture of clay, ash, salt, quicklime, and rice hulls for several weeks to several months, depending on the processing method."
Çılbır,lbr,Turkish,egg,"[""Turkish""]","[""Turkey"", ""Bosnia and Herzegovina"", ""Montenegro"", ""Serbia""]",Western Asia,The dish consists of poached eggs with yogurt (often with garlic mixed in).
Creamed eggs on toast,creamed_eggs_on_toast,American,bread,"[""American""]","[""United States""]",Northern America,"The dish consists of toast or biscuits covered in a gravy made from béchamel sauce and chopped hard-boiled eggs. The gravy is often flavored with various seasonings, such as black pepper, garlic powder, celery salt, Worcestershire sauce, sherry, chopped parsley and/or chopped chives."
Boiled egg,boiled_egg,Global,egg,"[""Global""]","[""Global""]",Global,"The dish is egg, typically from a chicken, cooked with their shells unbroken, usually by immersion in boiling water. Hard-boiled version are cooked so that the egg white and egg yolk both solidify, while soft-boiled version may leave the yolk, and sometimes the white, at least partially liquid and raw. "
Coddled egg,coddled_egg,Global,egg,"[""Global""]","[""Global""]",Global,"The dish refers to eggs that have been cracked into a ramekin or another small container, placed in a water bath or bain-marie and gently or lightly cooked just below boiling temperature. They can be partially cooked, mostly cooked, or hardly cooked at all"
Custard pie,custard_pie,American,cake,"[""American""]","[""United States""]",Northern America,"The dish is any type of uncooked custard mixture placed in an uncooked or partially cooked crust and baked together.The dish commonly refers to a plain mixture of milk, eggs, sugar, salt, vanilla extract and sometimes nutmeg combined with a pie crust."
Danbing,danbing,Taiwanese,pancake,"[""Taiwanese""]","[""Taiwan""]",Eastern Asia,"The dish is an egg pancake or rolled egg crepe. The dough is made by kneading flour, potato starch, glutinous rice flour, and water into a thin dough, and an omelet is baked on top of the dough"
Divinity,divinity,American,confectionery,"[""American""]","[""United States""]",Northern America,"The dish is a nougat-like confection made with whipped egg white, corn syrup, and sugar. Optional ingredients such as flavors, chopped dried fruit and chopped nuts are frequently added."
Deep fried egg,deep_fried_egg,Global,egg,"[""Global""]","[""Global""]",Global,"It is an egg dish consisting of an egg that has been deep fried. Sometimes the dish is prepared only using the egg yolk. Various types of eggs can be used, such as chicken, duck and quail eggs."
Egg bhurji,egg_bhurji,Indian,egg,"[""Indian""]","[""India"", ""Sri Lanka"", ""Pakistan"", ""Nepal"", ""Bhutan"", ""Bangladesh""]",Southern Asia,"The dish is a scrambled egg with tomatoes, chilies, onion, and fragrant spices."
Egg butter,egg_butter,Finnish,egg,"[""Finnish""]","[""Finland"", ""Estonia""]",Northern Europe,The dish is a mixture of butter and chopped hard boiled eggs.
Zucchini slice,zucchini_slice,Australian,egg,"[""Australian"", ""New Zealand""]","[""Australia"", ""New Zealand""]",Australia and New Zealand,"The dish consists of zucchini, eggs, cheese, usually bacon, and flour, baked to form a flat loaf. It is then cut into squares and served as a main dish or a side dish, often eaten for lunch."
Zabaione,zabaione,Italian,dessert,"[""Italian""]","[""Italy""]",Southern Europe,"The dish is a type of dessert, or sometimes a beverage, made with egg yolks, sugar, and a sweet wine. Some versions of the recipe incorporate spirits such as cognac. The dessert version is a light custard, whipped to incorporate a large amount of air."
Tokneneng,tokneneng,Filipino,egg,"[""Filipino""]","[""Philippines""]",South Eastern Asia,The dish is a tempura-like street food made by deep-frying orange batter covered hard-boiled chicken or duck eggs.
Telur pindang,telur_pindang,Indonesian,egg,"[""Indonesian""]","[""Indonesia"", ""Malaysia"", ""Singapore""]",South Eastern Asia,"The dish is a hard-boiled egg cooked in the pindang process. The eggs are boiled slowly in water mixed with salt, soy sauce, shallot skins, teak leaf, and other spices."
Telur gulung,telur_gulung,Indonesian,egg,"[""Indonesian""]","[""Indonesia""]",South Eastern Asia,The dish is a food in which an egg is fried and then rolled using a skewer which is usually made of bamboo.
Tea egg,tea_egg,Chinese,egg,"[""Chinese""]","[""China""]",Eastern Asia,"The dish is a savory food commonly sold as a snack, in which a boiled egg is cracked slightly and then boiled again in tea, and sauce or spices. It is also known as marble egg because cracks in the egg shell create darkened lines with marble-like patterns."
Nargesi,nargesi,Iranian,egg,"[""Iranian""]","[""Iran""]",Southern Asia,"The dish is made with eggs, fried onion and spinach. It's spiced with salt, garlic, and pepper."
Nargesi kebab,nargesi_kebab,Indian,egg,"[""Indian""]","[""India"", ""Pakistan"", ""Afghanistan""]",Southern Asia,"The dish prepared by wrapping a mixture of minced meat, usually beef, diced onions and various spices, around a boiled egg, which is then fried in ghee or butter and eaten alongside curry or other condiments"
Kogel mogel,kogel_mogel,Polish,dessert,"[""Polish""]","[""Poland""]",Eastern Europe,"The dish is made from egg yolks, sugar, and flavourings such as honey, vanilla, cocoa or rum. In its classic form it is served slightly chilled or at room temperature. Served warm or hot, it is considered a home remedy for sore throats."
Iron egg,iron_egg,Taiwanese,egg,"[""Taiwanese""]","[""Taiwan""]",Eastern Asia,"The dish consists of small eggs that have been repeatedly stewed in a mix of spices and air-dried. The resulting eggs are dark brown on the outside, chewy in texture, and very flavourful compared to standard boiled eggs."
Huevos motuleños,huevos_motuleos,Mexican,egg,"[""Mexican""]","[""Mexico"", ""Cuba"", ""Costa Rica""]",Caribbean,"The dish is made with eggs on tortillas with black beans and cheese, often with other ingredients such as ham, peas, plantains, and hot sauce."
Gyeran-ppang,gyeranppang,Korean,egg,"[""Korean""]","[""Korea""]",Eastern Asia,The dish is a fluffy oblong-shaped loaf of bread is sweet and savory with a whole egg inside the pancake dough.
Frozen custard,frozen_custard,American,dessert,"[""American""]","[""United States""]",Northern America,"The dish is a frozen dessert that is a type of ice cream that is made with egg yolks in addition to cream and sweetener, either sugar or an alternative, and an additional flavoring such as cocoa, vanilla, or fruit such as strawberries or peaches."
French toast,french_toast,French,bread,"[""French""]","[""France""]",Western Europe,"The dish consists of sliced bread soaked in beaten eggs and often milk or cream, then pan-fried. When it is served as a sweet dish, sugar, vanilla, or cinnamon are also commonly added before pan-frying, and then it may be topped with sugar (often powdered sugar), butter, fruit, or syrup. When it is a savory dish, it is generally fried with a pinch of salt or pepper, and it can then be served with a sauce such as ketchup or mayonnaise."
Floating island,floating_island,French,dessert,"[""French""]","[""France""]",Western Europe,The dish is a dessert consisting of meringue floating on a vanilla custard. The meringue used is baked in a bain-marie. It may be served at room temperature or chilled.
Eggs Kejriwal,eggs_kejriwal,Indian,egg,"[""Indian""]","[""India""]",Southern Asia,"It is a dish of eggs topped with cheese and chilis, typically served over toast."
Egg foo young,egg_foo_young,Chinese,egg,"[""Chinese""]","[""China""]",Eastern Asia,"The dish is an omelette prepared with beaten eggs and most often made with various Vegetable such as bean sprouts, bamboo shoots, sliced cabbage, spring onions, mushrooms, and water chestnuts. When meat is used as an ingredient, a choice of roast pork, shrimp, chicken, beef, or lobster may be offered."
Egg drop soup,egg_drop_soup,Chinese,soup,"[""Chinese""]","[""China""]",Eastern Asia,"The dish is a soup of wispy beaten eggs in chicken broth. Condiments such as black or white pepper, and finely chopped scallions and tofu, are commonly added to the soup. The soup is made by adding a thin stream of beaten eggs to the boiling broth in the final moments of cooking, creating thin, silken strands or flakes of cooked egg that float in the soup."
Egg salad,egg_salad,Global,egg,"[""Global""]","[""Global""]",Global,"It is a dish consisting of chopped hard-boiled or scrambled eggs, mustard, and mayonnaise, and Vegetable often including other ingredients such as celery."
Egg sandwich,egg_sandwich,Global,egg,"[""Global""]","[""Global""]",Global,"The dish is a sandwich with some kind of cooked egg filling. Fried eggs, scrambled eggs, omelette, sliced boiled eggs and egg salad (a mix of chopped cooked egg and mustard and mayonnaise) are popular options."
Eggs and brains,eggs_and_brains,Portuguese,egg,"[""Portuguese""]","[""Portugal"", ""Austria"", ""United States""]",Northern America,The dish consists of pork brains (or those of another mammal) and scrambled eggs.
Haminados,haminados,Spanish,egg,"[""Spanish""]","[""Spain""]",Southern Europe,"The dish consists of eggs that are cooked for a long time, resulting in red-brown whites and darkened yolks."
Hangtown fry,hangtown_fry,American,egg,"[""American""]","[""United States""]",Northern America,"The most common version of the dish includes bacon and oysters combined with eggs, and fried together."
Huevos rancheros,huevos_rancheros,Mexican,egg,"[""Mexican""]","[""Mexico""]",Central America,"The basic dish consists of fried eggs served on lightly fried or charred corn or flour tortillas topped with a spicy salsa made of tomatoes, chili peppers, and onion. Common accompaniments include refried beans, rice, and guacamole or slices of avocado, with cilantro as a garnish."
Perico,perico,Colombian,egg,"[""Colombian"", ""Venezuelan""]","[""Colombia"", ""Venezuela""]",South America,"The dish is prepared with scrambled eggs, butter, sautéed diced onions, bell pepper, and tomatoes. Scallions are a frequent substitution or addition to the onions."
Huevos estrellados,huevos_estrellados,Spanish,egg,"[""Spanish""]","[""Spain""]",Southern Europe,"The dish is any of a number of dishes involving eggs fried in a large amount of olive oil or any other oil. The dish can be accompanied by french fries and some kind of meat (typically ham, bacon, or a sausage)."
Masala omelette,masala_omelette,Indian,egg,"[""Indian""]","[""India""]",Southern Asia,"The dish is a variant of the omelette. Its main ingredients are eggs, herbs, tomatoes and spices that vary by region."
Kuku,kuku,Iranian,egg,"[""Iranian""]","[""Iran"", ""Azerbaijan""]",Southern Asia,"The dish is made of whipped eggs with various ingredients folded in. It is served either hot or cold as a starter, side dish, or a main course, and is accompanied with bread and either yogurt or salad."
Machacado con huevo,machacado_con_huevo,Mexican,egg,"[""Mexican""]","[""Mexico"", ""United States""]",Central America,"The basic dish is made with scrambled eggs and dried beef. Chopped tomatoes, onions and chili peppers can be added, or salsa can be cooked into it, to create another version."
Matzah brei,matzah_brei,North American,egg,"[""North American""]","[""United States""]",Northern America,"The basic ingredients are matzah, eggs, and a ""softening"" liquid for the matzah, such as hot water or milk. Typically the dry matzah is broken into pieces, briefly softened in water or milk, mixed with beaten eggs, and fried in a skillet. The frying is done with oil or butter. The matzah and egg mixture may be scrambled, set to cook like a pancake, or fried like a tortilla."
Menemen,menemen,Turkish,stew,"[""Turkish""]","[""Turkey""]",Western Asia,"The dish is a popular traditional dish that includes eggs, tomato, green peppers, and spices such as ground black and red pepper cooked in olive oil. The tomatoes are typically finely diced or may be grated. Grated and diced tomatoes can also be mixed together, depending on the cook's preferred texture. If onions are being used, they may be added to the pan with the green chili peppers and sautéed with heated butter or oil."
Steak and eggs,steak_and_eggs,American,meat,"[""American""]","[""United States""]",Northern America,The dish is a dish of beefsteak and fried eggs. It is most typically served as a breakfast or brunch food.
Strata,strata,American,casserole,"[""American""]","[""United States""]",Northern America,"The dish is a family of layered casserole dishes. The most common modern variant is a brunch dish, made from a mixture which mainly consists of bread, eggs and cheese. It may also include meat or vegetable. The usual preparation requires the bread to be layered with the filling in order to produce layers."
