Name,wc_id,primary_cuisine,primary_coarse,Cuisines,Countries,Region1,Text Description
Chocolate chip cookie,chocolate_chip_cookie,American,snack,"[""American""]","[""United States""]",Northern America,The dish is a drop cookie that features chocolate chips or chocolate morsels as its distinguishing ingredient.
Chocolate-coated marshmallow treats,chocolatecoated_marshmallow_treats,Danish,dessert,"[""Danish""]","[""Denmark""]",Northern Europe,The dish is a confection consisting of a biscuit base topped with marshmallow-like filling and then coated in a hard shell of chocolate.
Cowboy cookies,cowboy_cookies,American,snack,"[""American""]","[""United States""]",Northern America,"The dish is a type of drop cookie made with oatmeal, chocolate chips, pecans, and coconut."
Cuchuflí,cuchufl,Chilean,snack,"[""Chilean"", ""Argentinian""]","[""Chile"", ""Argentina""]",South America,"The dish is a tubular-shaped desserts made from sugar, egg whites, flour, butter, and vanilla that are often filled with dulce de leche or other sweet fillings."
Cornish fairing,cornish_fairing,British,snack,"[""British""]","[""United Kingdom""]",Northern Europe,"The dish is a sweet and spicy ginger biscuit, made with standard biscuit ingredients such as flour, caster sugar and butter, together with mixed spice, ginger, cinnamon and golden syrup."
Coyotas,coyotas,Mexican,snack,"[""Mexican""]","[""Mexico""]",Central America,"The dish is a large, flat cookie traditionally filled with brown sugar. It also comes in various flavors like guava, caramel, chocolate, strawberry, milk candy, peach, and pineapple."
Cream cracker,cream_cracker,Irish,snack,"[""Irish""]","[""Ireland""]",Northern Europe,"The dish is made of wheat flour, vegetable oil, and yeast and commonly served with cheese as form of biscuit."
Cuccidati,cuccidati,Italian,snack,"[""Italian""]","[""Italy""]",Southern Europe,"The dish is made from a pastry dough, covered with icing and topped with rainbow sprinkles."
Custard cream,custard_cream,British,snack,"[""British""]","[""United Kingdom""]",Northern Europe,"The dish is a type of sandwich biscuit filled with a creamy, custard-flavoured centre."
Digestive biscuit,digestive_biscuit,British,snack,"[""British""]","[""Scotland""]",Northern Europe,The dish is a semi-sweet biscuit that was first developed by two doctors to aid digestion.
Drabbelkoek,drabbelkoek,Dutch,snack,"[""Dutch""]","[""Netherlands""]",Western Europe,The dish is a sort of round and hard cookie which made by dribbling strings of the liquid dough in hot butter.
Dutch letter,dutch_letter,Dutch,dessert,"[""Dutch""]","[""Netherlands""]",Western Europe,"The dish is a type of pastry that is typically prepared using a mixture of flour, eggs and butter or puff pastry as its base and filled with almond paste (or persipan), dusted with sugar and shaped in an ""S"" or other letter shape."
Empire biscuit,empire_biscuit,British,snack,"[""British""]","[""United Kingdom""]",Northern Europe,"The dish is a type of sweet biscuit that has a layer of jam in between two biscuits, typically shortbread. The top is covered with white water icing, usually decorated with a glace cherry in the centre, but Dew Drops are common too."
Fig roll,fig_roll,Middle Eastern,snack,"[""Middle Eastern"", ""Turkish""]","[""Bahrain"", ""Cyprus"", ""Iran"", ""Iraq"", ""Israel"", ""Jordan"", ""Kuwait"", ""Lebanon"", ""Oman"", ""Qatar"", ""Saudi Arabia"", ""Syria"", ""Turkey"", ""United Arab Emirates"", ""Yemen""]",Western Asia,The dish is a biscuit or cookie consisting of a rolled cake or pastry filled with fig paste.
Finskepinner,finskepinner,Swedish,snack,"[""Swedish"", ""Norwegian"", ""Danish""]","[""Sweden"", ""Norway"", ""Denmark""]",Northern Europe,"The dish is a shortbread cookie characterized by its long shape, crispy texture, and its frequent consumption during Christmas."
Florentine biscuit,florentine_biscuit,Italian,snack,"[""Italian""]","[""Italy""]",Southern Europe,"The dish is a made of nuts (typically hazelnuts and almonds) and candied cherries mixed with sugar melted together with butter and honey, cooked in an oven. They are often coated on the bottom with chocolate, which is traditionally scored in a wave pattern with the tines of a fork for decoration."
Flour kurabiye,flour_kurabiye,Turkish,snack,"[""Turkish""]","[""Turkey""]",Western Asia,"The dish is a kind of cookie that is made from butter, sunflower oil (or another mild flavored oil), baking powder, and the namesake ingredient flour. Generally, vanilla powder is also added."
Fortune cookie,fortune_cookie,Japanese,snack,"[""Japanese"",""American"",""Chinese""]","[""United States"",""Japan"", ""China""]",Eastern Asia,"The dish is a crisp, sugary cookie wafer made from flour, sugar, vanilla, and sesame seed oil with a piece of paper inside."
Fudge cookie,fudge_cookie,Global,snack,"[""Global""]","[""Global""]",Global,"The dish is a is a cookie that is prepared with fudge or that has the flavor, consistency or texture of fudge."
Rosquillo,rosquillo,Filipino,snack,"[""Filipino""]","[""Philippines""]",South Eastern Asia,"The dish is a cookie made from flour, eggs, shortening, sugar, and baking powder."
Galletas de patatas,galletas_de_patatas,Filipino,snack,"[""Filipino""]","[""Philippines""]",South Eastern Asia,The dish is a thick and square-shaped biscuit with upturned edges.
Garibaldi biscuit,garibaldi_biscuit,British,snack,"[""British""]","[""United Kingdom""]",Northern Europe,The dish consists of currants squashed and sandwiched between two thin oblongs of biscuit dough before baking.
Gazelle ankles,gazelle_ankles,Algerian,snack,"[""Algerian"", ""Egyptian"", ""Libyan"", ""Moroccan"", ""Tunisian"", ""Western Saharan""]","[""Algeria"", ""Egypt"", ""Libya"", ""Morocco"", ""Sudan"", ""Tunisia"", ""Western Sahara""]",Northern Africa,The dish is a crescent-shaped cookies made of flour-based dough filled with almond paste aromatized with orange blossom water.
Qurabiya,qurabiya,Arabic,snack,"[""Arabic"", ""Balkan"", ""Ottoman""]","[""Albania"", ""Algeria"", ""Armenia"", ""Bulgaria"", ""Greece"", ""Cyprus"", ""Iran"", ""Kuwait"", ""Libya"", ""Morocco"", ""Saudi Arabia"", ""Turkey"", ""Tunisia""]",Southern Asia,"The dish is a shortbread-type biscuit, usually made with ground almonds."
Gingerbread,gingerbread,Global,bread,"[""Global""]","[""Global""]",Global,"The dish refers to a broad category of baked goods, typically flavored with ginger, cloves, nutmeg, and cinnamon and sweetened with honey, sugar, or molasses."
Gingerbread man,gingerbread_man,English,snack,"[""English""]","[""England""]",Northern Europe,"The dish is a biscuit or cookie made from gingerbread, usually in the shape of a stylized human being following seasonal themes."
Ginger snap,ginger_snap,British,snack,"[""British"", ""American"", ""New Zealand""]","[""United Kingdom"", ""Canada"", ""United States"", ""New Zealand"", ""Denmark"", ""Sweden"", ""Finland"", ""Norway"", ""Latvia"", ""Estonia""]",Australia and New Zealand,"The dish is a biscuit flavoured with ginger. The dish is flavoured with powdered ginger and a variety of other spices, most commonly cinnamon, molasses and clove."
Half-moon cookie,halfmoon_cookie,Filipino,snack,"[""Filipino""]","[""Philippines""]",South Eastern Asia,The dish  is a semicircle- or crescent-shaped butter cookie. It has a soft crumbly texture and a sweet flavor with a salty aftertaste.
Hamantash,hamantash,Ashkenazi Jewish,dessert,"[""Ashkenazi Jewish""]","[""Israel""]",Western Asia,"The dish is a triangular filled-pocket pastry. Most popular fillings are various jams, especially apricot and raspberry, but also date, raisins, apple, vanilla pastry cream with chocolate chips, cherry, fig, chocolate, dulce de leche, halva, caramel, or cheese."
Jacobina,jacobina,Filipino,snack,"[""Filipino""]","[""Philippines""]",South Eastern Asia,The dish is a biscuit that are distinctively cubical in shape.
Jammie Dodgers,jammie_dodgers,British,snack,"[""British""]","[""United Kingdom""]",Northern Europe,The dish is a  biscuit made from shortcake with a raspberry or strawberry flavoured jam filling.
Joe Frogger,joe_frogger,American,snack,"[""American""]","[""United States""]",Northern America,"The dish is a type of cookie flavored with molasses, rum, and spices (ginger, allspice, nutmeg, cloves) and has a soft, chewy center."
Jodenkoek,jodenkoek,Dutch,snack,"[""Dutch""]","[""Netherlands""]",Western Europe,"The dish is a big, flat, round shortbread biscuit with a diameter of about 10 centimeters (4"")."
Jumble,jumble,Italian,snack,"[""Italian""]","[""Italy""]",Southern Europe,"The dish is a butter cookies made with a basic recipe of flour, sugar, eggs, and butter. They can be flavored with vanilla, anise, caraway seed, or other flavoring like almond. They were formerly often made in the form of rings or rolls."
Kaasstengels,kaasstengels,Dutch,snack,"[""Dutch""]","[""Netherlands"", ""Indonesia""]",South Eastern Asia,The dish is a cheese snack in the shape of sticks. It tastes savoury and salty instead of sweet.
Kahk,kahk,Egyptian,snack,"[""Egyptian""]","[""Egypt""]",Northern Africa,"The dish is a small circular biscuit. It is covered with powdered sugar and can be stuffed with ʿagameyya (a mixture of honey, nuts, and ghee), lokum, walnuts, pistachios, or dates, or simply served plain."
Khapse,khapse,Tibetan,snack,"[""Tibetan""]","[""China""]",Eastern Asia,"The dish is a deep-fried biscuit. The dough is usually made with flour, eggs, butter and sugar and is then shaped into different shapes and sizes. Some are sprinkled with powdered sugar, while other shapes, such as the donkey ear-shaped, are decorative."
Kiâm-piánn,kimpinn,Taiwanese,snack,"[""Taiwanese""]","[""Taiwan""]",Eastern Asia,"The dish is a biscuit which is characterized by a crispy texture and a savory taste with a hint of pepper, which becomes subtly sweet upon chewing."
Kichel,kichel,Belarusian,dessert,"[""Belarusian"", ""Bulgarian"", ""Czech"", ""Hungarian"", ""Moldovan"", ""Polish"", ""Romanian"", ""Russian"", ""Slovak"", ""Ukrainian""]","[""Belarus"", ""Bulgaria"", ""Czech Republic"", ""Hungary"", ""Moldova"", ""Poland"", ""Romania"", ""Russia"", ""Slovakia"", ""Ukraine""]",Eastern Europe,"This dish is a slightly sweet cracker or cookie. Made from eggs, flour, and sugar, the dough is rolled out flat and cut into bow-tie shapes."
Kleicha,kleicha,Iraqi,snack,"[""Iraqi""]","[""Iraq"", ""Saudi Arabia"", ""Iran""]",Western Asia,"The dish comes in several traditional shapes and fillings. The most popular are the ones filled with dates. There are also sweet discs, as well as half moons filled with nuts, sugar and/or desiccated coconut. They are usually flavoured with cardamom and sometimes rose water, and glazed with egg wash, which may sometimes be scented and coloured with saffron."
Koulourakia,koulourakia,Greek,dessert,"[""Greek""]","[""Greece""]",Southern Europe,"The dish is a butter-based pastry, traditionally hand-shaped, with egg glaze on top. They have a sweet delicate flavor with a hint of vanilla. They are well known for their sprinkle of sesame seeds and distinctive ring shape."
Krumiri,krumiri,Italian,snack,"[""Italian""]","[""Italy""]",Southern Europe,"The dish is a biscuit made without water from wheat flour, sugar, butter, eggs and vanilla, in the form of a slightly bent, rough-surfaced cylinder."
Krumkake,krumkake,Norwegian,snack,"[""Norwegian""]","[""Norway"", ""United States"", ""Germany""]",Western Europe,"The dish is a waffle cookie made of flour, butter, eggs, sugar, and cream. While hot, the dish is rolled into small cones around a wooden or plastic cone form. The dish can be eaten plain or filled with whipped cream (often multekrem) or other fillings."
Kue gapit,kue_gapit,Indonesian,snack,"[""Indonesian""]","[""Indonesia""]",South Eastern Asia,"This dish is a kind of cracker generally made from tapioca flour. Its name comes from the cooking process, in which it is grilled between iron molds like a waffle."
Kue satu,kue_satu,Indonesian,snack,"[""Indonesian""]","[""Indonesia""]",South Eastern Asia,This dish is a traditional cookie made of sweet white-colored mung bean powder that crumbles when bitten.
Ladyfinger,ladyfinger,French,snack,"[""French""]","[""France""]",Western Europe,"This dish is a low-density, dry, egg-based, sweet sponge cake biscuit roughly shaped like large fingers."
Lebkuchen,lebkuchen,German,cake,"[""German""]","[""Germany""]",Western Europe,"The dish honey-sweetened cakes, moulded cookies or bar cookies."
Lengua de gato,lengua_de_gato,Filipino,snack,"[""Filipino""]","[""Philippines""]",South Eastern Asia,"The dish is made from butter, flours, sugar, eggs, and milk. They are very thin and crunchy."
Lincoln biscuit,lincoln_biscuit,Irish,snack,"[""Irish""]","[""Ireland""]",Northern Europe,"The dish is a circular shortcake biscuit, most commonly decorated on one side with a pattern of raised dots."
Linga,linga,Filipino,snack,"[""Filipino""]","[""Philippines""]",South Eastern Asia,"The dish made from flour, sugar, salt, shortening, and sesame seeds. They are characteristically flat and baked until they are a deep brown color. They range in shape and size from small and circular to large and oblong. They are usually dipped in hot drinks like coffee or tsokolate before eating."
Ma'amoul,maamoul,Arabic,dessert,"[""Arabic""]","[""Algeria"", ""Bahrain"", ""Comoros"", ""Djibouti"", ""Egypt"", ""Iraq"", ""Jordan"", ""Kuwait"", ""Lebanon"", ""Libya"", ""Mauritania"", ""Morocco"", ""Oman"", ""Palestine"", ""Qatar"", ""Saudi Arabia"", ""Somalia"", ""Sudan"", ""Syria"", ""Tunisia"", ""United Arab Emirates"", ""Yemen""]",Western Africa,"The dish is a filled butter cookie made with semolina flour. The filling can be made with dried fruits like figs, dates, or nuts such as pistachios or walnuts, and occasionally almonds."
Malted milk,malted_milk,English,snack,"[""English""]","[""England""]",Northern Europe,"The dish named after their malt flavouring and milk content. The biscuit design varies spending on manufacturers, commonly seen designs include two milk churns and a cow. They are typically baked for a short period of time (about 5 minutes) at high temperature to keep them crisp without the use of holes unlike other biscuits such as shortbread."
Mamón tostado,mamn_tostado,Cebu,dessert,"[""Cebu""]","[""Philippines""]",South Eastern Asia,"The dish is a fusion of flour, shortening, eggs, and sugar and is similarly airy, but it is baked until dry and crunchy."
Maple leaf cream cookie,maple_leaf_cream_cookie,Canadian,dessert,"[""Canadian""]","[""Canada""]",Northern America,"The dish is a sandwich cookies. The cream filling is maple-flavoured, and may contain real maple syrup."
Marie biscuit,marie_biscuit,British,snack,"[""British""]","[""United Kingdom""]",Northern Europe,"The dish is a biscuit with name embossed upon top surface made from wheat flour, sugar, palm oil, and vanilla-flavoured."
Masa podrida,masa_podrida,Filipino,dessert,"[""Filipino""]","[""Philippines""]",South Eastern Asia,"The dish made from flour, salt, baking powder, brown sugar, shortening, and eggs. It has a dry crumbly texture similar to half-moon cookies."
Nice biscuit,nice_biscuit,British,snack,"[""British""]","[""England""]",Northern Europe,"The dish is a plain or coconut-flavoured biscuit. It is thin, rectangular in shape, with serrated edges, lightly covered with a scattering of large sugar crystals and often with the word ""NICE"" imprinted on top in sans-serif capital letters. It is often served as an accompaniment to hot drinks, such as tea. "
Nocciolini di Canzo,nocciolini_di_canzo,Italian,snack,"[""Italian""]","[""Italy""]",Southern Europe,"The dish is a sweet crumbly small cookie. It is made from hazelnut flour (local hazelnuts and sugar) and egg white. The appearance of this sweet is a small half-sphere. They are usually eaten as a snack but, due to their small size, they can also be used as cake decoration."
Oatmeal raisin cookie,oatmeal_raisin_cookie,American,dessert,"[""American""]","[""United States""]",Northern America,"The dish is made from an oatmeal dough with raisins. Its ingredients also typically include flour, sugar, eggs, salt, and spices."
Paciencia,paciencia,Filipino,snack,"[""Filipino""]","[""Philippines""]",South Eastern Asia,"The dish is made from beaten egg whites, flour, and calamansi with hemispherical shape."
Paborita,paborita,Filipino,snack,"[""Filipino""]","[""Philippines""]",South Eastern Asia,"The dish is a disc-shaped biscuit with a flaky texture made from wheat flour, sugar, skim milk, salt, baking pwoeder, alum, and cooking oil"
Panellets,panellets,Spanish,dessert,"[""Spanish""]","[""Spain""]",Southern Europe,The dish is a ball-shaped snack made from chestnuts and sweet potatoes covered in pinenuts.
Paprenjak,paprenjak,Croatian,snack,"[""Croatian""]","[""Croatia""]",Southern Europe,"The dish contains a unique mix of honey and black pepper. The main ingredients are sugar syrup or honey, butter or fat, eggs, nuts (walnuts, hazelnuts), pepper and various spices (clove, cinnamon, nutmeg).  Apart from the ingredients, it is unique with its mould-pressed motifs used to decorate the biscuit."
Peanut butter cookie,peanut_butter_cookie,American,snack,"[""American""]","[""United States""]",Northern America,The dish is a type of cookie that is distinguished for having peanut butter as a principal ingredient.
Petit-Beurre,petitbeurre,French,snack,"[""French""]","[""France""]",Western Europe,The dish is a type of shortbread surface of the biscuit is smooth and has twenty-four indents (four lines with six columns) intermixed with the inscription of the dish name in three lines.
Pepernoot,pepernoot,Dutch,snack,"[""Dutch""]","[""Netherlands""]",Western Europe,"The dish is light brown, square shaped, and made from the same ingredients as taai-taai: rye flour, sugar and anise, and sometimes also cinnamon, and clove. They are fairly chewy, though they harden gradually when exposed to the air. "
Pinolate,pinolate,Italian,snack,"[""Italian""]","[""Italy""]",Southern Europe,"The dish is a type of cookie light golden color and studded with golden pine nuts (pinoli in Italian). Made with almond paste and egg whites, they are moist, soft and chewy."
Piñata cookie,piata_cookie,Mexican,snack,"[""Mexican""]","[""Mexico""]",Central America,The dish is a sugar cookie that is shaped and colored like a rainbow colored horse and filled with various small candies which spill out when the cookie is broken.
Polvorón,polvorn,Spanish,dessert,"[""Spanish""]","[""Spain""]",Southern Europe,"The dish is a type of heavy, soft, and very crumbly shortbread made of flour, sugar, milk, and nuts (especially almonds)."
Pineapple tart,pineapple_tart,Indonesian,dessert,"[""Indonesian"",""Malaysian"",""Singaporean"",""Bruneian""]","[""Indonesia"",""Malaysia"",""Singapore"",""Brunei Darussalam""]",South Eastern Asia,"The dish is a small, bite-size tart filled with pineapple jam made with butter and egg yolk."
Pizzelle,pizzelle,Italian,dessert,"[""Italian""]","[""Italy""]",Southern Europe,"The dish is a type of waffle cookies made with flour, eggs, sugar, butter or vegetable oil, and flavoring (usually anise or anisette, less commonly vanilla or lemon zest). They can be hard and crisp or soft and chewy[citation needed] depending on the ingredients and method of preparation."
Kue putri salju,kue_putri_salju,Indonesian,snack,"[""Indonesian""]","[""Indonesia""]",South Eastern Asia,The dish is dried cake shaped like crescents and covered with powdered sugar.
Rainbow cookie,rainbow_cookie,Italian,cake,"[""Italian"",""American""]","[""Italy"",""United States""]",Northern America,"The dish is layered almond flavored cookie and cake, typically with rainbow color"
Reshteh khoshkar,reshteh_khoshkar,Iranian,snack,"[""Iranian""]","[""Iran""]",Southern Asia,"The dish is a cookie amde of rice flour, and filled with sugar, walnuts or hazeulnuts, cardamom, cinnamon, ginger, and spice."
Ricciarelli,ricciarelli,Italian,snack,"[""Italian""]","[""Italy""]",Southern Europe,"The dish is a biscuit made from almonds, sugar, honey, egg whites."
Rich tea,rich_tea,British,snack,"[""British""]","[""United Kingdom""]",Northern Europe,"The dish is a type of sweet biscuit; the ingredients generally include wheat flour, sugar, vegetable oil and malt extract."
Roscas,roscas,Filipino,snack,"[""Filipino""]","[""Philippines""]",South Eastern Asia,"The dish is a type of pastry cookies made from lard, anise, flour, sugar, butter and eggs."
Rosette,rosette,Iranian,fritter,"[""Iranian"", ""Turkish"", ""Sri Lankan""]","[""Iran"", ""Turkey"", ""Sri Lanka""]",Southern Asia,"The dish is thin, cookie-like fritters made with iron molds. The batter is a blend of wheat flour, eggs, sugar and whole milk. They are formed with a rose iron. This specialized tool has a long handle and with a metal shape, commonly stars, flowers, snowflakes or Christmas trees. The metal is heated in hot oil before it is dipped in batter. Returning the iron to the oil, the batter is detached from the mold when it is partially cooked and gently flipped to finish cooking. They are usually topped with sugar or honey, or the edges of them are dipped into frosting."
Rum ball,rum_ball,English,dessert,"[""English"", ""Australian"", ""Canadian"", ""German"", ""New Zealand"", ""American"", ""Austrian"", ""Slovenian"", ""Hungarian"", ""Greek"", ""Czech"", ""Danish""]","[""England"", ""Australia"", ""Canada"", ""Germany"", ""New Zealand"", ""United States"", ""Austria"", ""Slovenia"", ""Hungary"", ""Greece"", ""Czech Republic"", ""Denmark""]",Global,"The dish is a truffle-like confectionery cake of cookie butter flavoured with chocolate and rum. They are roughly the size of a golf ball and often coated in chocolate sprinkles, desiccated coconut, or cocoa. These treats contain rum. Because they are not baked, the alcohol flavour and kick are not neutralized during preparation. They are especially popular during the holiday season."
Russian tea cake,russian_tea_cake,American,pastry,"[""American"", ""Russian""]","[""United States"", ""Russia""]",Northern America,"The dish is a kind of pastry, often eaten around Christmas. It is have a relatively simple recipe, generally consisting entirely of flour, water, butter, and ground nuts, the nut variety depending upon the cookie type. After baking, they are rolled in powdered sugar while still hot, then coated again once the cookie has cooled."
Sandwich cookie,sandwich_cookie,Global,cookies,"[""Global""]","[""Global""]",Global,The dish is a type of cookie made from two thin cookies or medium cookies with a filling between them.
Kue semprong,kue_semprong,Indonesian,biscuit,"[""Indonesian"",""Malaysian"",""Bruneian"", ""Singaporean""]","[""Indonesia"",""Malaysia"",""Brunei Darussalam"", ""Singapore""]",South Eastern Asia,The dish is a wafer snack made by clasping egg batter using an iron mold (Waffle iron) which is heated up on a charcoal stove.
Shortbread,shortbread,Scottish,biscuit,"[""Scottish""]","[""Scotland""]",Northern Europe,"The dish is made from one part white sugar, two parts butter and three to four parts plain wheat flour. It does not contain any leavening, such as baking powder or baking soda. It is widely associated with Christmas and Daft days festivities."
Silvana,silvana,Filipino,cookies,"[""Filipino""]","[""Philippines""]",South Eastern Asia,The dish is frozen cookie consisting of a layer of buttercream sandwiched between two cashew-meringue wafers coated with cookie crumbs.
Snickerdoodle,snickerdoodle,American,cookies,"[""American""]","[""United States""]",Northern America,"The dish is a type of cookie made with flour, fat, sugar, and salt, and rolled in cinnamon sugar. Eggs may also sometimes be used as an ingredient, with cream of tartar and baking soda added to leaven the dough. They are characterized by a cracked surface and can be either crisp or soft depending on the ingredients used."
Speculaas,speculaas,German,biscuit,"[""German"", ""Belgian"", ""French"", ""Dutch""]","[""Germany"", ""Belgium"", ""France"", ""Netherlands""]",Western Europe,The dish is a type of spiced shortcrust biscuit baked with spices. They are usually flat and are often moulded to carry certain traditional images.
Springerle,springerle,German,cookies,"[""German""]","[""Germany"", ""Switzerland"", ""Austria"", ""France""]",Western Europe,The dish is a type of biscuit or cookie with an embossed design made by pressing a mold onto rolled dough and allowing the impression to dry before baking. This preserves the detail of the surface pattern.
Spritzgebäck,spritzgebck,German,cookies,"[""German"", ""French""]","[""Germany"", ""France""]",Western Europe,"The dish is a type biscuit or cookie made of a rich shortcrust pastry. When made correctly, the cookies are crisp, fragile, somewhat dry, and buttery."
Square cookie,square_cookie,Taiwanese,cookies,"[""Taiwanese""]","[""Taiwan""]",Eastern Asia,"The dish is primary include baked milk powder, butter or lard, sesame seeds, and sugar. The preparation involves mixing low-gluten flour with these ingredients to form a dough, which is then divided into small portions. Separately, medium-gluten flour is kneaded to create the outer layer. Each portion of the filling is wrapped in the outer layer, flattened, folded multiple times, and then baked until crispy. The resulting texture and flavor, characterized by the rich taste of butter and sesame, are what make these cookies particularly appealing."
Stroopwafel,stroopwafel,Dutch,cookies,"[""Dutch""]","[""Netherlands""]",Western Europe,"The dish is a thin, round cookie made from two layers of sweet baked dough held together by syrup filling."
